A1: Date | C1: Place | E1: Paid by | G1: Fuel | I1: Mooring | K1: Food | M1: Transport | O1: Other
A2: 39583 | C2: Diperk | E2: Visa | O2: 3003.66
A3: 39599 | C3: GYC club | E3: Visa | O3: 159.59
A4: 39602 | C4: Dover B&Q | E4: Visa | O4: 41.62
A5: 39602 | C5: Dover Sharp & Enright | E5: Visa | O5: 51.84
A6: 39602 | C6: Dover George Hammond | E6: Visa | O6: 89.6
A7: 39602 | C7: Dover Netto | E7: Switch | K7: 53.47
A8: 39603 | C8: Dover Harbour | E8: Visa | I8: 26.4
A9: 39605 | C9: Sovereign Harbour | E9: Visa | I9: 29.5
A10: 39605 | C10: Newhaven Marina | E10: Cash | I10: 23
A11: 39606 | C11: Newhaven Boat Exibitions Chandlers | E11: Visa | O11: 26.91
A12: 39607 | C12: Newhaven Somerfield | E12: Cash | K12: 21.65
A13: 39607 | C13: Newhaven Somerfield | E13: Cash | K13: 21.65
A14: 39607 | C14: Newhaven Fuels | E14: Cash | G14: 52.15
A15: 39607 | C15: Shoreham Port | E15: Cash | I15: 15
A16: 39609 | C16: Chichester Harbour | E16: Cash | I16: 10
A17: 39615 | C17: Southampton Golden Arrow Marine | E17: Cash | O17: 13.28
A18: 39616 | C18: Shamrock Quay | E18: Visa | K18: 26.5
A19: 39616 | C19: Southampton Shamrock Chandlery | E19: Cash | O19: 2.4
A20: 39616 | C20: Southampton Machine Mart | E20: Visa | O20: 40.48
A21: 39617 | C21: Southampton SL Spares | E21: Visa | O21: 9.55
A22: 39617 | C22: Southampton Wilts | E22: Cash | O22: 17.32
A23: 39618 | C23: Southampton Shamrock Quay Chandlers | E23: Cash | O23: 20.5
A24: 39619 | C24: Shamrock Quay | E24: Visa | K24: 28.9
A25: 39622 | C25: Southampton Saxon Wharf | E25: Visa | O25: 577.71
A26: 39622 | C26: Southampton Shamrock Quay Chandlers | E26: Visa | O26: 37.48
A27: 39622 | C27: Southampton Tesco | E27: Cash | K27: 34.29
A28: 39622 | C28: Southampton Shamrock Quay Chandlers | E28: Cash | O28: 1.3
A29: 39623 | C29: Southampton Golden Arrow Marine | E29: Cash | O29: 40.37
A30: 39623 | C30: Southampton Shamrock Quay Chandlers | E30: Cash | O30: 26.99
A31: 39625 | C31: Poole Piplers | E31: Visa | O31: 49.36
A32: 39626 | C32: Southampton Maplin | E32: Visa | O32: 68.81
A33: 39628 | C33: Poole Quay | E33: Visa | I33: 154.32
A34: 39628 | C34: Weymouth Harbour | E34: Visa | I34: 26.4
A35: 39629 | C35: Weymouth Harbour | E35: Visa | I35: 26.4
A36: 39629 | C36: Weymouth Harbour | E36: Visa | I36: 48.4
A37: 39630 | C37: Weymouth Harbour | E37: Visa | G37: 71.15
A38: 39631 | C38: Dartmouth Chandlers | E38: Visa | O38: 133.99
A39: 39633 | C39: Dartmouth Canvas | E39: Visa | O39: 32
A40: 39637 | C40: Darthaven Marina | E40: Visa | I40: 208.21
A41: 39637 | C41: Darthaven Marina | E41: Visa | G41: 12.33 | I41: 196.38
A42: 39637 | C42: Dartmouth Harbour | E42: Cash | I42: 7.8
A43: 39639 | C43: Devon | E43: Visa | O43: 40.2
A44: 39639 | C44: Salcombe | E44: Cash | I44: 21.6
A45: 39639 | C45: Dartmouth Harbour | E45: Cash | I45: 7.8
A46: 39639 | C46: Salcombe Fortescue Inn | E46: Cash | K46: 40.2
A47: 39640 | C47: Devon Marine Fuels | E47: Visa | G47: 49.4
A48: 39643 | C48: Fowey Harbour | E48: Cash | I48: 45
A49: 39645 | C49: Falmouth Harbour | E49: Cash | I49: 6.8
A50: 39648 | C50: Falmouth Harbour | E50: Cash | I50: 6.8
A51: 39648 | C51: Falmouth Bosun's Locker | E51: Visa | O51: 41.9
A52: 39651 | C52: Bryer Fraggle Rock | E52: Visa | K52: 50.5
A53: 39652 | C53: Tresco IOS | E53: Visa | O53: 30.99
A54: 39657 | C54: Bodmin Parkway | E54: Visa | M54: 10.9
A55: 39657 | C55: Paignton | E55: Cash | M55: 17
A56: 39665 | C56: Padstow Harbour | E56: Visa | G56: 25.9 | I56: 178.5
A57: 39667 | C57: Lundy | E57: Visa | K57: 14.5
A58: 39667 | C58: Padstow Harbour | E58: Cash | G58: 40.95
A59: 39670 | C59: Milford Haven Tesco | E59: Visa | K59: 13.6
A60: 39670 | C60: Milford Haven Port | E60: Visa | G60: 48.22
A61: 39674 | C61: WHS | E61: Visa | O61: 20
A62: 39674 | C62: IOM B&Q | E62: Visa | O62: 13.94
A63: 39674 | C63: IOM Harbour | E63: Cash | I63: 12
A64: 39674 | C64: IOM Harbour | E64: Cash | G64: 2.5 | I64: 12
A65: 39674 | C65: Manx Marine | E65: Visa | G65: 34.2
A66: 39675 | C66: Partpatrick | E66: Cash | I66: 16
A67: 39678 | C67: Troon Yatchhaven | E67: Visa | I67: 28.32
A68: 39679 | C68: Ardishaig British Waterways | E68: Visa | I68: 185.5
A69: 39680 | C69: Crinan Boatyard | E69: Visa | G69: 15.83
A70: 39680 | C70: Crinan Boatyard | E70: Visa | O70: 157.88
A71: 39682 | C71: Glengarry Castle Hotel | E71: Visa | K71: 28
A72: 39696 | C72: Caley Marina | E72: Visa | G72: 89.96
A73: 39696 | C73: Seaport Marina Muirtown Wharf | E73: Visa | G73: 61.06
A74: 39696 | C74: Caley CoOp | E74: Cash | K74: 39.73
A75: 39742 | C75: Stonehaven Tolbooth | E75: Visa | K75: 64.95
A76: 39742 | C76: Peterhead Marina | E76: Visa | G76: 64.31 | I76: 495
A77: 39746 | C77: Port Edgar | E77: Visa | I77: 217.18
A78: 39746 | C78: Port Edgar Bosun's Locker | E78: Cash | O78: 11.5
A79: 39747 | C79: Edinburgh B&G | E79: Visa | O79: 7.76
A80: 39767 | C80: Port Edgar | E80: Visa | G80: 110.59
A81: 39770 | C81: Hartlepool Marina | E81: Visa | G81: 44.86
A82: 39772 | C82: Scarborough Argos | E82: Visa | O82: 11.99
A83: 39798 | C83: Humber Cruising Association | E83: Cheque | G83: 44.37
A85: Totals | G85: =SUM(G1:G83) -> 767.78 | I85: =SUM(I1:I83) -> 2004.31 | K85: =SUM(K1:K83) -> 437.94 | M85: =SUM(M1:M83) -> 27.9 | O85: =SUM(O1:O83) -> 4780.92 | Q85: Grand Total | R85: =SUM(G85:O85) -> 8018.85